{
  "schema": 1,
  "id": "wpt.css-backgrounds.css3-background-origin-border-box",
  "upstream": {
    "repository": "https://github.com/web-platform-tests/wpt",
    "revision": "db80bd24a77f1b5f8ba40a5b320dec3720a37c8d",
    "path": "css/css-backgrounds/css3-background-origin-border-box.html",
    "reference_path": "css/css-backgrounds/reference/css3-background-origin-border-box-ref.html",
    "license": "BSD-3-Clause",
    "assertion": "A no-repeat background with border-box origin starts beneath the border rather than at the padding edge.",
    "adaptation": "The resource image is replaced by a constant green gradient explicitly sized to 20 logical pixels. A transparent solid border makes samples distinguish the border-box origin from the padding-box origin without coupling the case to dashed-border rasterization."
  },
  "test": { "commands": [
    { "type": "attach_surface", "width": 100.0, "height": 100.0, "scale": 1.0 },
    { "type": "present_scene", "revision": 1, "nodes": [{
      "id": 1, "parent": null, "rect": [0.0, 0.0, 100.0, 100.0],
      "background": { "kind": "named", "value": "transparent" },
      "border": {
        "widths": [10.0, 10.0, 10.0, 10.0],
        "colors": [{ "kind": "named", "value": "transparent" }, { "kind": "named", "value": "transparent" }, { "kind": "named", "value": "transparent" }, { "kind": "named", "value": "transparent" }],
        "styles": ["solid", "solid", "solid", "solid"],
        "radii": [[0.0, 0.0], [0.0, 0.0], [0.0, 0.0], [0.0, 0.0]]
      },
      "background_layer": {
        "size": [{ "length": 20.0, "fraction": 0.0 }, { "length": 20.0, "fraction": 0.0 }],
        "repeat_x": "no_repeat", "repeat_y": "no_repeat", "origin": "border"
      },
      "linear_gradient": { "angle_degrees": 180.0, "stops": [
        { "color": { "kind": "named", "value": "green" }, "position": 0.0 },
        { "color": { "kind": "named", "value": "green" }, "position": 1.0 }
      ] }
    }] },
    { "type": "checkpoint", "name": "paint.background-layers.origin-border-box", "samples": [
      { "point": [1.0, 1.0], "color": { "kind": "named", "value": "green" }, "tolerance": 5 },
      { "point": [18.0, 18.0], "color": { "kind": "named", "value": "green" }, "tolerance": 5 },
      { "point": [21.0, 10.0], "color": { "kind": "named", "value": "transparent" }, "tolerance": 5 }
    ] }
  ] }
}
