{
  "schema": 1,
  "id": "wpt.css2.borders.border-top-style-007",
  "upstream": {
    "repository": "https://github.com/web-platform-tests/wpt",
    "revision": "db80bd24a77f1b5f8ba40a5b320dec3720a37c8d",
    "path": "css/CSS2/borders/border-top-style-007.xht",
    "reference_path": null,
    "license": "BSD-3-Clause",
    "assertion": "A groove border uses two shades of its border color to appear carved into the canvas.",
    "adaptation": "The WPT manual visual assertion is represented by semantic style projection, an unchanged green background sample, and a relative luminance assertion requiring the outer half of the top border to be darker than its inner half. Exact shade colors remain Host-defined."
  },
  "test": {
    "commands": [
      { "type": "attach_surface", "width": 100.0, "height": 24.0, "scale": 1.0 },
      {
        "type": "present_box",
        "revision": 1,
        "rect": [0.0, 0.0, 100.0, 24.0],
        "background": { "kind": "named", "value": "green" },
        "border": {
          "widths": [12.0, 0.0, 0.0, 0.0],
          "colors": [
            { "kind": "named", "value": "green" },
            { "kind": "named", "value": "transparent" },
            { "kind": "named", "value": "transparent" },
            { "kind": "named", "value": "transparent" }
          ],
          "styles": ["groove", "none", "none", "none"],
          "radii": [0.0, 0.0, 0.0, 0.0]
        }
      },
      {
        "type": "checkpoint",
        "name": "paint.box",
        "samples": [
          { "point": [50.0, 18.0], "color": { "kind": "named", "value": "green" }, "tolerance": 16 }
        ],
        "relations": [
          { "first": [50.0, 2.0], "second": [50.0, 9.0], "relation": "darker", "minimum_difference": 10 }
        ]
      }
    ]
  }
}
