{
  "schema": 1,
  "id": "wpt.css2.borders.border-top-style-006",
  "upstream": {
    "repository": "https://github.com/web-platform-tests/wpt",
    "revision": "db80bd24a77f1b5f8ba40a5b320dec3720a37c8d",
    "path": "css/CSS2/borders/border-top-style-006.xht",
    "reference_path": null,
    "license": "BSD-3-Clause",
    "assertion": "A double border-top renders two solid lines separated by a transparent gap.",
    "adaptation": "The WPT manual visual assertion is represented by semantic style projection plus logical-pixel samples in the outer line, center gap, inner line, and white box background. The specified 9px width divides into three equal bands."
  },
  "test": {
    "commands": [
      { "type": "attach_surface", "width": 100.0, "height": 20.0, "scale": 1.0 },
      {
        "type": "present_box",
        "revision": 1,
        "rect": [0.0, 0.0, 100.0, 20.0],
        "background": { "kind": "named", "value": "white" },
        "border": {
          "widths": [9.0, 0.0, 0.0, 0.0],
          "colors": [
            { "kind": "named", "value": "black" },
            { "kind": "named", "value": "transparent" },
            { "kind": "named", "value": "transparent" },
            { "kind": "named", "value": "transparent" }
          ],
          "styles": ["double", "none", "none", "none"],
          "radii": [0.0, 0.0, 0.0, 0.0]
        }
      },
      {
        "type": "checkpoint",
        "name": "paint.box",
        "samples": [
          { "point": [50.0, 1.0], "color": { "kind": "named", "value": "black" }, "tolerance": 16 },
          { "point": [50.0, 4.0], "color": { "kind": "named", "value": "white" }, "tolerance": 16 },
          { "point": [50.0, 7.0], "color": { "kind": "named", "value": "black" }, "tolerance": 16 },
          { "point": [50.0, 15.0], "color": { "kind": "named", "value": "white" }, "tolerance": 16 }
        ]
      }
    ]
  }
}
