{
  "schema": 1,
  "id": "wpt.css-masking.clip-path-circle-002",
  "upstream": {
    "repository": "https://github.com/web-platform-tests/wpt",
    "revision": "db80bd24a77f1b5f8ba40a5b320dec3720a37c8d",
    "path": "css/css-masking/clip-path/clip-path-circle-002.html",
    "reference_path": "css/css-masking/clip-path/reference/clip-path-circle-ref.html",
    "license": "BSD-3-Clause",
    "assertion": "A percentage circle basic shape is resolved against the border box and clips the element.",
    "adaptation": "The 200px upstream circle is reduced to a 100px box and a red child crosses its left edge so samples also verify descendant clipping."
  },
  "test": {
    "commands": [
      { "type": "attach_surface", "width": 140.0, "height": 140.0, "scale": 1.0 },
      {
        "type": "present_scene",
        "revision": 1,
        "nodes": [
          {
            "id": 1,
            "parent": null,
            "rect": [0.0, 0.0, 140.0, 140.0],
            "background": { "kind": "named", "value": "white" }
          },
          {
            "id": 2,
            "parent": 1,
            "rect": [20.0, 20.0, 100.0, 100.0],
            "background": { "kind": "named", "value": "green" },
            "clip_path": {
              "reference_box": "border",
              "shape": {
                "kind": "circle",
                "radius": { "length": 0.0, "fraction": 0.4 },
                "center": [
                  { "length": 0.0, "fraction": 0.5 },
                  { "length": 0.0, "fraction": 0.5 }
                ]
              }
            }
          },
          {
            "id": 3,
            "parent": 2,
            "rect": [-10.0, 40.0, 40.0, 20.0],
            "background": { "kind": "named", "value": "red" }
          }
        ]
      },
      {
        "type": "checkpoint",
        "name": "paint.visual-effects.clip-path-circle",
        "samples": [
          { "point": [20.0, 70.0], "color": { "kind": "named", "value": "white" }, "tolerance": 5 },
          { "point": [35.0, 70.0], "color": { "kind": "named", "value": "red" }, "tolerance": 5 },
          { "point": [70.0, 70.0], "color": { "kind": "named", "value": "green" }, "tolerance": 5 },
          { "point": [30.0, 30.0], "color": { "kind": "named", "value": "white" }, "tolerance": 5 },
          { "point": [70.0, 35.0], "color": { "kind": "named", "value": "green" }, "tolerance": 5 }
        ]
      }
    ]
  }
}
