{
  "schema": 1,
  "id": "wpt.css-backgrounds.box-shadow-001",
  "upstream": {
    "repository": "https://github.com/web-platform-tests/wpt",
    "revision": "db80bd24a77f1b5f8ba40a5b320dec3720a37c8d",
    "path": "css/css-backgrounds/box-shadow-001.htm",
    "reference_path": null,
    "license": "BSD-3-Clause",
    "assertion": "A positive horizontal box-shadow offset paints the shadow to the right of the border box.",
    "adaptation": "The upstream one-inch box and 96px offset are represented as a 100 logical-pixel box and 100 logical-pixel offset. Direct pixel samples replace the upstream red-underlay visual comparison."
  },
  "test": {
    "commands": [
      { "type": "attach_surface", "width": 220.0, "height": 120.0, "scale": 1.0 },
      {
        "type": "present_scene",
        "revision": 1,
        "nodes": [
          {
            "id": 1,
            "parent": null,
            "rect": [10.0, 10.0, 100.0, 100.0],
            "background": { "kind": "named", "value": "white" },
            "box_shadows": [
              {
                "offset": [100.0, 0.0],
                "blur_radius": 0.0,
                "spread_radius": 0.0,
                "color": { "kind": "named", "value": "black" }
              }
            ]
          }
        ]
      },
      {
        "type": "checkpoint",
        "name": "paint.visual-effects.box-shadow-offset",
        "samples": [
          { "point": [50.0, 50.0], "color": { "kind": "named", "value": "white" }, "tolerance": 5 },
          { "point": [150.0, 50.0], "color": { "kind": "named", "value": "black" }, "tolerance": 5 },
          { "point": [5.0, 50.0], "color": { "kind": "named", "value": "transparent" }, "tolerance": 5 },
          { "point": [215.0, 50.0], "color": { "kind": "named", "value": "transparent" }, "tolerance": 5 }
        ]
      }
    ]
  }
}
